<!--

  XML Document Type Definition for python-dirtt - Directory Tree Templater.

  Copyright (C) 2011-2026 Robert Moggach

  Licensed under the MIT license: https://opensource.org/licenses/MIT

-->

<!--
  dirtt is an XML language - Typical usage:
<?xml version="1.0" encoding="UTF-8"?>
<!DOCTYPE dirtt PUBLIC "-//STUDIO//DTD dirtt 1.0//EN"
      "http://rjmoggach.github.io/python-dirtt/dtds/dirtt.dtd">
<dirtt name="Project Tree" version="1.0"
       dirname="/jobs" basename="myproject">
</dirtt>

  Note the http:// system identifier. libxml2 (xmllint, lxml, and most
  XML editors) is built without TLS support and cannot fetch an https://
  DTD, so an https system identifier silently disables validation.
-->

<!-- XInclude, used to compose one template out of several -->
<!ELEMENT   xi:include  EMPTY>
<!ATTLIST   xi:include
            href        CDATA        #REQUIRED
            parse       CDATA        #IMPLIED
            xmlns:xi    CDATA        #IMPLIED>

<!-- 'root' of directory tree template, our starting point.
     At least one of dirname/basename is required; when basename is
     omitted it is split off the end of dirname. That "one or the
     other" rule cannot be expressed in a DTD, so both are #IMPLIED
     here and the constraint is enforced by the parser. -->
<!ELEMENT   dirtt       (dir | file | link | xi:include)*>
<!ATTLIST   dirtt
            basename    CDATA        #IMPLIED
            dirname     CDATA        #IMPLIED
            name        CDATA        #IMPLIED
            version     CDATA        #IMPLIED
            id          ID           #IMPLIED
            username    CDATA        #IMPLIED
            group       CDATA        #IMPLIED
            perms       CDATA        #IMPLIED
            xmlns:xi    CDATA        #IMPLIED>

<!-- Folder/Directory -->
<!ELEMENT   dir         (dir | file | link | xi:include)*>
<!ATTLIST   dir
            basename    CDATA        #REQUIRED
            id          ID           #IMPLIED
            name        CDATA        #IMPLIED
            username    CDATA        #IMPLIED
            group       CDATA        #IMPLIED
            perms       CDATA        #IMPLIED
            dirname     CDATA        #IMPLIED
            xmlns:xi    CDATA        #IMPLIED>

<!-- File -->
<!ELEMENT   file        EMPTY>
<!ATTLIST   file
            basename    CDATA        #REQUIRED
            id          ID           #IMPLIED
            name        CDATA        #IMPLIED
            username    CDATA        #IMPLIED
            group       CDATA        #IMPLIED
            perms       CDATA        #IMPLIED
            href        CDATA        #IMPLIED
            substitute  (true|false) #IMPLIED
            dirname     CDATA        #IMPLIED>

<!-- Symbolic Link -->
<!ELEMENT  link         EMPTY>
<!ATTLIST  link
           basename     CDATA        #REQUIRED
           id           ID           #IMPLIED
           name         CDATA        #IMPLIED
           idref        IDREF        #IMPLIED
           ref          CDATA        #IMPLIED
           dirname      CDATA        #IMPLIED>
