<?xml version="1.0" encoding="UTF-8"?>
<!DOCTYPE dirtt PUBLIC "-//STUDIO//DTD dirtt 1.0//EN" "http://rjmoggach.github.io/python-dirtt/dtds/dirtt.dtd">
<dirtt name="Project Tree" version="0.2.0" dirname="{{project_root}}" basename="{{project_path}}" username="pipeline" group="artist" perms="02755" xmlns:xi="http://www.w3.org/2001/XInclude">
<!-- M A S T E R   F O L D E R -->
  <dir name="Project Master Directory" basename="master" username="pipeline" group="supervisor" perms="02755" xmlns:xi="http://www.w3.org/2001/XInclude">
  <xi:include href="project_master.xml" parse="xml"/>
  </dir>
<!-- W O R K   F O L D E R -->
  <dir name="Project Work Directory" basename="work" username="pipeline" group="supervisor" perms="02755">
  </dir>
<!-- S E Q U E N C E S   F O L D E R -->
  <dir name="Project Sequences Directory" basename="sequences" username="pipeline" group="supervisor" perms="02755">
  </dir>
<!-- I N C O M I N G   F O L D E R -->
  <dir name="Project Incoming Directory" basename="incoming" username="pipeline" group="artist" perms="02777">
  </dir>
<!-- P R O D U C T I O N   F O L D E R -->
  <dir name="Project Production Directory" basename="production" username="pipeline" group="supervisor" perms="02775">
  </dir>
<!-- F L A M E   F O L D E R -->
  <dir name="Project Flame Directory" basename="flame" username="pipeline" group="supervisor" perms="02777">
  </dir>
</dirtt>
