<?xml version="1.0" encoding="UTF-8"?>
<!DOCTYPE dirtt PUBLIC "-//STUDIO//DTD dirtt 1.0//EN" "http://rjmoggach.github.io/python-dirtt/dtds/dirtt.dtd">
<dirtt name="Master Tree" version="0.2.0" dirname="{{project_root}}/{{project_path}}" basename="master" username="pipeline" group="supervisor" perms="02775">
    <!-- R I G   F O L D E R -->
    <dir basename="rig" username="pipeline" group="supervisor" perms="02755">
      <dir basename="cam" username="pipeline" group="artist" perms="02775"/>
      <dir basename="char" username="pipeline" group="artist" perms="02775"/>
      <dir basename="env" username="pipeline" group="artist" perms="02775"/>
      <dir basename="prop" username="pipeline" group="artist" perms="02775"/>
    </dir>
    <!-- S U R V E Y   F O L D E R -->
    <dir basename="survey" username="pipeline" group="supervisor" perms="02755">
      <dir basename="cam" username="pipeline" group="artist" perms="02775"/>
      <dir basename="char" username="pipeline" group="artist" perms="02775"/>
      <dir basename="env" username="pipeline" group="artist" perms="02775"/>
      <dir basename="prop" username="pipeline" group="artist" perms="02775"/>
    </dir>
    <!-- M O D E L   F O L D E R -->
    <dir basename="model" username="pipeline" group="supervisor" perms="02755">
      <dir basename="char" username="pipeline" group="artist" perms="02775"/>
      <dir basename="env" username="pipeline" group="artist" perms="02775"/>
      <dir basename="prop" username="pipeline" group="artist" perms="02775"/>
    </dir>
    <!-- F X   F O L D E R -->
    <dir basename="fx" username="pipeline" group="supervisor" perms="02755">
      <dir basename="char" username="pipeline" group="artist" perms="02775"/>
      <dir basename="env" username="pipeline" group="artist" perms="02775"/>
      <dir basename="prop" username="pipeline" group="artist" perms="02775"/>
    </dir>
    <!-- L I G H T   F O L D E R -->
    <dir basename="light" username="pipeline" group="supervisor" perms="02755">
      <dir basename="char" username="pipeline" group="artist" perms="02775"/>
      <dir basename="env" username="pipeline" group="artist" perms="02775"/>
      <dir basename="prop" username="pipeline" group="artist" perms="02775"/>
      <link basename="sourceimages" ref="../images/textures"/>
    </dir>
    <!-- C O M P   F O L D E R -->
    <dir basename="comp" username="pipeline" group="supervisor" perms="02755">
      <link basename="lut" ref="../data/lut"/>
      <link basename="lens" ref="../data/lens"/>
      <link basename="chan" ref="../data/chan"/>
      <link basename="timewarp" ref="../data/chan"/>
      <link basename="grain" ref="../images/grain"/>
      <link basename="paint" ref="../images/paint"/>
      <link basename="design" ref="../images/design"/>
      <link basename="fonts" ref="../data/fonts"/>
      <dir basename="scripts" username="pipeline" group="artist" perms="02775"/>
      <dir basename="tools" username="pipeline" group="supervisor" perms="02775">
        <link basename="nuke" ref="../../tools/nuke"/>
      </dir>
    </dir>
    <!-- I M A G E S   F O L D E R -->
    <dir basename="images" username="pipeline" group="supervisor" perms="02755">
      <dir basename="grain" username="pipeline" group="artist" perms="02775"/>
      <dir basename="textures" username="pipeline" group="supervisor" perms="02775">
        <dir basename="cam" username="pipeline" group="artist" perms="02775"/>
        <dir basename="char" username="pipeline" group="artist" perms="02775"/>
        <dir basename="env" username="pipeline" group="artist" perms="02775"/>
        <dir basename="prop" username="pipeline" group="artist" perms="02775"/>
      </dir>
      <dir basename="hdri" username="pipeline" group="artist" perms="02775"/>
      <dir basename="design" username="pipeline" group="artist" perms="02775"/>
      <dir basename="paint" username="pipeline" group="artist" perms="02775">
        <dir basename="ai" username="pipeline" group="artist" perms="02775"/>
        <dir basename="geo" username="pipeline" group="artist" perms="02775"/>
        <dir basename="mudbox" username="pipeline" group="artist" perms="02775"/>
        <dir basename="psd" username="pipeline" group="artist" perms="02775"/>
      </dir>
    </dir>
    <!-- D A T A   F O L D E R -->
    <dir basename="data" username="pipeline" group="supervisor" perms="02755">
      <dir basename="audio" username="pipeline" group="artist" perms="02775"/>
      <dir basename="fonts" username="pipeline" group="artist" perms="02775"/>
      <dir basename="chan" username="pipeline" group="artist" perms="02775"/>
      <dir basename="lens" username="pipeline" group="supervisor" perms="02775">
        <dir basename="uv" username="pipeline" group="artist" perms="02775"/>
        <dir basename="grids" username="pipeline" group="artist" perms="02775"/>
      </dir>
      <dir basename="lut" username="pipeline" group="supervisor" perms="02775"/>
      <dir basename="timewarp" username="pipeline" group="artist" perms="02775"/>
      <dir basename="cache" username="pipeline" group="artist" perms="02775"/>
    </dir>
    <!-- T O O L S   F O L D E R -->
    <dir basename="tools" username="pipeline" group="supervisor" perms="02755">
      <dir basename="config" username="pipeline" group="artist" perms="02775"/>
      <dir basename="environment" username="pipeline" group="artist" perms="02775"/>
      <dir basename="maya" username="pipeline" group="supervisor" perms="02755">
        <dir basename="mel" username="pipeline" group="artist" perms="02775"/>
        <dir basename="python" username="pipeline" group="artist" perms="02775"/>
        <dir basename="presets" username="pipeline" group="artist" perms="02775"/>
        <dir basename="shelves" username="pipeline" group="artist" perms="02775"/>
        <dir basename="templates" username="pipeline" group="artist" perms="02775"/>
      </dir>
      <dir basename="nuke" username="pipeline" group="supervisor" perms="02755">
        <dir basename="plugins" username="pipeline" group="artist" perms="02775"/>
        <dir basename="gizmos" username="pipeline" group="artist" perms="02775"/>
        <dir basename="scripts" username="pipeline" group="artist" perms="02775"/>
      </dir>
      <dir basename="scripts" username="pipeline" group="artist" perms="02775"/>
      <dir basename="vray" username="pipeline" group="artist" perms="02775"/>
    </dir>
</dirtt>
