<?xml version="1.0" encoding="UTF-8"?>
<!DOCTYPE dirtt PUBLIC "-//DSHNG//DTD dirtt 0.1.4//EN" "/dashing/tools/var/dirtt/dtds/dirtt.dtd">
<dirtt name="Project Tree" version="0.1.4" dirname="{{projects_root}}" basename="{{project_path}}" username="pipeline" group="artist" perms="02755">

<!-- C O N F I G   F O L D E R -->
	<dir name="Project Config Folder" basename="etc" username="pipeline" group="supervisor" perms="02755" id="config-id">
		<dir basename="houdini" username="pipeline" group="supervisor" perms="02755">
			<dir basename="dso" username="pipeline" group="supervisor" perms="02775"/>
            <dir basename="otls" username="pipeline" group="supervisor" perms="02775"/>
            <dir basename="scripts" username="pipeline" group="supervisor" perms="02775"/>
        </dir><!-- houdini -->
		<dir basename="maya" username="pipeline" group="supervisor" perms="02755">
            <dir basename="modules" username="pipeline" group="supervisor" perms="02775"/>
            <dir basename="plugins" username="pipeline" group="supervisor" perms="02775"/>
            <dir basename="scripts" username="pipeline" group="supervisor" perms="02755">
                <dir basename="mel" username="pipeline" group="supervisor" perms="02775"/>
                <dir basename="py" username="pipeline" group="supervisor" perms="02775"/>
            </dir>
			<dir basename="shelves" username="pipeline" group="supervisor" perms="02775"/>
		</dir><!-- maya -->
		<dir basename="nuke" username="pipeline" group="supervisor" perms="02755">
			<dir basename="gizmos" username="pipeline" group="supervisor" perms="02775"/>
			<dir basename="menu" username="pipeline" group="supervisor" perms="02775"/>
			<dir basename="scripts" username="pipeline" group="supervisor" perms="02775"/>
		</dir><!-- nuke -->
		<dir basename="user" username="pipeline" group="supervisor" perms="02775"/>
		<dir basename="vray" username="pipeline" group="supervisor" perms="02775"/>
	</dir><!-- etc -->

<!-- F L A M E   F O L D E R -->
	<dir name="Project Flame Projects Folder" basename="flame" username="flame" group="supervisor" perms="02775">
	</dir><!-- flame -->

<!-- L I B R A R Y   F O L D E R -->
	<dir name= "Project Library Folder" basename="library" username="pipeline" group="supervisor" perms="02755">
		<dir basename="audio" username="pipeline" group="artist" perms="02775"/>
		<dir basename="data" username="pipeline" group="artist" perms="02755">
			<dir basename="chan" username="pipeline" group="artist" perms="02775"/>
			<dir basename="db" username="pipeline" group="artist" perms="02775"/>
			<dir basename="lut" username="pipeline" group="artist" perms="02775"/>
			<dir basename="mocap" username="pipeline" group="artist" perms="02775"/>
			<dir basename="moco" username="pipeline" group="artist" perms="02775"/>
		</dir><!-- data -->
		<dir basename="img">
			<dir basename="calibration" username="pipeline" group="supervisor" perms="02775"/>
			<dir basename="elements" username="pipeline" group="supervisor" perms="02775"/>
			<dir basename="grain" username="pipeline" group="supervisor" perms="02775"/>
			<dir basename="hdri" username="pipeline" group="supervisor" perms="02775"/>
			<dir basename="lens" username="pipeline" group="supervisor" perms="02775"/>
			<dir basename="paint" username="pipeline" group="supervisor" perms="02775"/>
			<dir basename="textures" username="pipeline" group="supervisor" perms="02775"/>
			<dir basename="stock" username="pipeline" group="supervisor" perms="02775"/>
		</dir><!-- img -->
		<dir basename="edits" username="pipeline" group="supervisor" perms="02755">
			<dir basename="_YYYY_MM_DD_name" username="pipeline" group="artist" perms="02755">
				<dir basename="edl" username="pipeline" group="artist" perms="02775"/>
				<dir basename="media" username="pipeline" group="artist" perms="02775"/>
			</dir>
		</dir><!-- edits -->
		<dir basename="fonts" username="pipeline" group="supervisor" perms="02775"/>
		<dir basename="graphics" username="pipeline" group="supervisor" perms="02775"/>
		<dir basename="models" username="pipeline" group="supervisor" perms="02775"/>
		<dir basename="reference" username="pipeline" group="supervisor" perms="02755">
			<dir basename="misc" username="pipeline" group="supervisor" perms="02775"/>
			<dir basename="on_set" username="pipeline" group="supervisor" perms="02755">
				<dir basename="_YYYY_MM_DD_name" username="pipeline" group="supervisor" perms="02775">
					<dir basename="edl" username="pipeline" group="supervisor" perms="02775"/>
					<dir basename="media" username="pipeline" group="supervisor" perms="02775"/>
				</dir>
			</dir><!-- on_set -->
		</dir><!-- reference -->
		<dir basename="shaders" username="pipeline" group="supervisor" perms="02755">
			<dir basename="vray" username="pipeline" group="supervisor" perms="02775"/>
			<dir basename="rman" username="pipeline" group="supervisor" perms="02775"/>
			<dir basename="mray" username="pipeline" group="supervisor" perms="02775"/>
		</dir><!-- shaders -->
		<dir basename="tools" username="pipeline" group="supervisor" perms="02775"/>
	</dir><!-- library -->

<!-- P R O D U C T I O N   F O L D E R -->
	<dir basename="production" username="pipeline" group="production" perms="02755">
		<dir basename="financial" username="pipeline" group="production" perms="02750">
			<dir basename="bid" username="pipeline" group="production" perms="02770"/>
			<dir basename="invoices" username="pipeline" group="production" perms="02770"/>
			<dir basename="purchases" username="pipeline" group="production" perms="02770"/>
		</dir><!-- financial -->
		<dir basename="creative" username="pipeline" group="production" perms="02755">
			<dir basename="breakdown" username="pipeline" group="production" perms="02775"/>
			<dir basename="script" username="pipeline" group="production" perms="02775"/>
			<dir basename="storyboard" username="pipeline" group="production" perms="02775"/>
			<dir basename="treatment" username="pipeline" group="production" perms="02775"/>
			<dir basename="reference" username="pipeline" group="production" perms="02775"/>
		</dir><!-- creative -->
		<dir basename="notes" username="pipeline" group="production" perms="02775"/>
		<dir basename="postings" username="pipeline" group="production" perms="02755">
			<dir basename="data" username="pipeline" group="production" perms="02775"/>
			<dir basename="stills" username="pipeline" group="production" perms="02775"/>
			<dir basename="movies" username="pipeline" group="production" perms="02775"/>
		</dir><!-- postings -->
		<dir basename="schedule" username="pipeline" group="production" perms="02775"/>
		<dir basename="shotsheets" username="pipeline" group="production" perms="02775"/>

		<link name="config" idref="config-id"/>
		<link name="assets" idref="assets-id"/>
		<link name="top"  idref="root-dir"/>
		<link name="external" ref="/tmp"/>
		<!-- Symbolic links to assets and configuration folders. -->
	</dir><!-- production -->

<!-- S E Q U E N C E S   F O L D E R -->
	<dir basename="sequences" username="pipeline" group="artist" perms="02755">
	</dir><!-- sequences -->

<!-- S H O T S   F O L D E R -->
	<dir basename="shots" username="pipeline" group="artist" perms="02755">
	</dir><!-- shots -->
		
</dirtt>
